{
  "verdict": "proceed",
  "confidence": 0.8,
  "alternatives_considered": [
    "Execute as-is",
    "Split phase 1 into two coder releases"
  ],
  "recommendation": "Proceed but split phase 1 to reduce blast radius.",
  "reasoning": "Read the plan and the affected docs; the risk is isolated to phase 1.",
  "summary": "Plan is sound"
}
